{
  "cycle_id": "2026-07-16-mvrv-01",
  "reviewed_at": "2026-07-17T00:00:00+00:00",
  "verdict": "pass",
  "invariants": [
    { "id": 1, "name": "1 post = 1 ideia", "status": "ok", "note": "Uma tese só: regime de custo-base baixo. Sem segundo insight embutido." },
    { "id": 2, "name": "KPI é bookmark", "status": "ok", "note": "Leitura de referência que um analista salvaria; não é isca de like." },
    { "id": 3, "name": "Link fora do corpo", "status": "ok", "note": "post.text sem URL; link vive em reply.link (verificado programaticamente)." },
    { "id": 4, "name": "Gráfico com leitura", "status": "ok", "note": "Título do 02_chart.png é a leitura ('faixa historicamente baixa'), não o nome do indicador." },
    { "id": 5, "name": "Responsabilidade (sem certeza de preço)", "status": "ok", "note": "Nenhuma previsão de preço nem promessa; 'não de topo' descreve o nível de MVRV, não a direção do preço. Reply reforça 'não é sinal de compra nem previsão'." },
    { "id": 6, "name": "Número texto = gráfico = fonte", "status": "ok", "note": "1,208 e 1,156 batem com 00_data.json e 02_chart_meta.json. 20,8% derivado exato de (1,208 − 1); tilde não usado, valor preciso." },
    { "id": 7, "name": "Gate humano inviolável", "status": "ok", "note": "APPROVAL.md emitido em STATUS: pending. Nenhuma auto-aprovação." },
    { "id": 8, "name": "Sem emoji/hype/jargão", "status": "ok", "note": "Varredura de termos proibidos: nenhum. Voz de terminal." },
    { "id": 9, "name": "Indicador válido/definido", "status": "ok", "note": "MVRV é indicador público padrão (não proprietário, não bloqueado). Definição básica presente no reply. Recomendação: registrar MVRV formalmente em knowledge/indicators.md (seção pública) — pendência menor, não bloqueia." }
  ],
  "numbers_reconciliation": [
    { "claim": "MVRV em 1,208", "in_text": 1.208, "in_chart": 1.208, "in_source": 1.208, "matches": true },
    { "claim": "20,8% acima do custo-base (derivado de 1,208 − 1)", "in_text": 20.8, "in_chart": 20.8, "in_source": 20.8, "matches": true },
    { "claim": "saiu de 1,156 (02/07)", "in_text": 1.156, "in_chart": 1.156, "in_source": 1.156, "matches": true }
  ],
  "blocks": [],
  "notes": "Pacote coerente. Segue para o Gate 2 humano. Pendência não-bloqueante: adicionar entrada de MVRV em knowledge/indicators.md."
}
