{
  "cycle_id": "2026-07-23-nupl-bear-easing-01",
  "reviewed_at": "2026-07-23T00:00:00+00:00",
  "verdict": "pass",
  "invariants": [
    {
      "id": 1,
      "name": "1 post = 1 ideia",
      "status": "ok",
      "note": "Uma tese: estado/trajetória do NUPL agregado (recuperando do fundo, ainda em faixa baixa). NUPL-STH só no reply, como contexto."
    },
    {
      "id": 2,
      "name": "KPI é bookmark",
      "status": "ok",
      "note": "Contexto de ciclo (posição do NUPL na faixa histórica de 3 anos) que o preço esconde — referência que um analista salva."
    },
    {
      "id": 3,
      "name": "Link fora do corpo",
      "status": "ok",
      "note": "post.text sem URL; link no reply."
    },
    {
      "id": 4,
      "name": "Gráfico com leitura",
      "status": "ok",
      "note": "Leitura no texto (imagem = screenshot real do terminal, decisão final). Gráfico 3 anos mostra euforia 2024 -> fundo -> recuperação."
    },
    {
      "id": 5,
      "name": "Responsabilidade (sem certeza de preço)",
      "status": "ok",
      "note": "Descreve posição/trajetória do NUPL, NÃO direção de preço; não afirma que o bear acabou nem vai continuar. Disclaimer no reply. NÃO usa o indicador de risco proprietário do Gui (Categoria B) — NUPL é a tradução pública."
    },
    {
      "id": 6,
      "name": "Número texto = gráfico = fonte",
      "status": "ok",
      "note": "0,199 (atual), ~0,13 (fundo) e >0,6 (pico 2024) rastreáveis em 00_data.json e visíveis no gráfico; NUPL-STH -0,032 no reply (fonte). Pico/fundo aproximados (leitura de gráfico), usados com ~/>. Lado in_chart = conferência VISUAL, pendente do arquivo do screenshot."
    },
    {
      "id": 7,
      "name": "Gate humano inviolável",
      "status": "ok",
      "note": "APPROVAL.md em STATUS: pending. Sem auto-aprovação."
    },
    {
      "id": 8,
      "name": "Sem emoji/hype/jargão",
      "status": "ok",
      "note": "Varredura limpa. 'bear' é termo de regime. Voz de terminal."
    },
    {
      "id": 9,
      "name": "Indicador válido/definido",
      "status": "ok",
      "note": "NUPL é público/padrão; o reply traz a definição. Pendência menor não-bloqueante: registrar NUPL em knowledge/indicators.md (primeiro uso)."
    }
  ],
  "numbers_reconciliation": [
    {
      "claim": "NUPL em 0,199 (atual)",
      "in_text": 0.199,
      "in_chart": "visual (pendente arquivo)",
      "in_source": 0.199,
      "matches": true
    },
    {
      "claim": "fundo ~0,13 (out/nov 2025)",
      "in_text": 0.13,
      "in_chart": "visual (pendente arquivo)",
      "in_source": 0.13,
      "matches": true
    },
    {
      "claim": "pico >0,6 (2024)",
      "in_text": 0.6,
      "in_chart": "visual (pendente arquivo)",
      "in_source": 0.6,
      "matches": true
    },
    {
      "claim": "NUPL-STH -0,032 (reply)",
      "in_text": -0.032,
      "in_chart": null,
      "in_source": -0.032,
      "matches": true
    }
  ],
  "blocks": [],
  "notes": "PASS em números/invariantes. FALTA a conferência VISUAL do gráfico (invariante 6): a imagem é o screenshot REAL do terminal (decisão final) — Mr. G anexa como ARQUIVO para virar 02_chart.png e eu confirmo enquadramento (cabeçalho+gráfico, sem toolbar/sidebar, marca d'água) e os valores visíveis. Pendência menor: registrar NUPL em indicators.md."
}
