{
  "cycle_id": "2026-07-20-mvrv-cohort-01",
  "reviewed_at": "2026-07-20T00:00:00+00:00",
  "verdict": "pass",
  "invariants": [
    { "id": 1, "name": "1 post = 1 ideia", "status": "ok", "note": "Uma tese: divergência de coorte no MVRV (STH abaixo do custo, LTH em lucro). No corpo do post só aparece MVRV; NUPL-STH/SOPR-STH ficam no reply como confirmação, não como segundo insight." },
    { "id": 2, "name": "KPI é bookmark", "status": "ok", "note": "Leitura por coorte que o MVRV agregado e o preço escondem — material de referência." },
    { "id": 3, "name": "Link fora do corpo", "status": "ok", "note": "post.text sem URL (verificado); link no reply." },
    { "id": 4, "name": "Gráfico com leitura", "status": "ok", "note": "Gráfico de barras por coorte com linha de breakeven em 1,0; título é a leitura ('MVRV agregado esconde a divisão')." },
    { "id": 5, "name": "Responsabilidade (sem certeza de preço)", "status": "ok", "note": "Descreve posicionamento de custo (quem está acima/abaixo do custo-base), sem prever direção. Reply reforça 'não é previsão de preço'. Nota: o vídeo do Gui prevê preços menores — essa previsão NÃO entrou no texto." },
    { "id": 6, "name": "Número texto = gráfico = fonte", "status": "ok", "note": "1,208 / 1,284 / 0,933 conferem com as coortes de 00_data.json e do gráfico; 6,7% = (1−0,933)×100 exato; NUPL-STH −0,072 e SOPR-STH 0,9849 conferem com o contexto da fonte." },
    { "id": 7, "name": "Gate humano inviolável", "status": "ok", "note": "APPROVAL.md em STATUS: pending. Sem auto-aprovação." },
    { "id": 8, "name": "Sem emoji/hype/jargão", "status": "ok", "note": "Varredura limpa. Voz de terminal." },
    { "id": 9, "name": "Indicador válido/definido", "status": "ok", "note": "MVRV/NUPL/SOPR são públicos e definidos (indicators.md). NENHUM indicador de Categoria B (ex.: 'indicador de risco/zona amarela' do Gui = Drawdown Risk interno) foi usado. Só dados reais que temos." }
  ],
  "numbers_reconciliation": [
    { "claim": "MVRV agregado em 1,208", "in_text": 1.208, "in_chart": 1.208, "in_source": 1.208, "matches": true },
    { "claim": "Long-term holders: 1,284", "in_text": 1.284, "in_chart": 1.284, "in_source": 1.284, "matches": true },
    { "claim": "Short-term holders: 0,933", "in_text": 0.933, "in_chart": 0.933, "in_source": 0.933, "matches": true },
    { "claim": "~6,7% abaixo do custo (derivado de 1 − 0,933)", "in_text": 6.7, "in_chart": null, "in_source": 6.7, "matches": true },
    { "claim": "NUPL-STH −0,072 (reply)", "in_text": -0.072, "in_chart": null, "in_source": -0.072, "matches": true },
    { "claim": "SOPR-STH 0,9849 (reply)", "in_text": 0.9849, "in_chart": null, "in_source": 0.9849, "matches": true }
  ],
  "blocks": [],
  "notes": "Pacote coerente. Ajustes do Mr. G aplicados e re-reconciliados: (1) link do reply trocado pela permalink exata do MVRV-STH (#metric=5b84739a00); (2) 'há semanas' removido do post — a frase final passou a 'quem comprou recente está no vermelho' (só o dado exato 0,933, sem caracterização qualitativa). POST 251/280. Aguardando confirmação final do Mr. G antes de publicar (STATUS permanece pending)."
}
